subject,content,bestanswer,ans0,ans1,ans2,ans3,ans4,ans5,ans6,ans7,ans8,ans9
yawn contagious,people yawn people room yawn,body need oxygen yawn yawn oxygen air density oxygen air lower people body feel start yawn oxygen yawn contagious yawning extremely contagious people witness yawn yawn minute visually impaired person hears tape yawning likely yawn face likelihood making end answer looking like gaping maw unlikely contagious nature yawning established know researcher currently giving topic attention theory suggests holdover period evolutionary history yawning served coordinate social behavior group animal recent study postulate contagious yawning neural network involved empathy mystery contagious yawning solved researcher closing answer hand given subject matter wouldn blame falling asleep wheel meantime yawn challenge try tougher look,yawning extremely contagious people witness yawn yawn minute visually impaired person hears tape yawning likely yawn face likelihood making end answer looking like gaping maw unlikely contagious nature yawning established know researcher currently giving topic attention theory suggests holdover period evolutionary history yawning served coordinate social behavior group animal recent study postulate contagious yawning neural network involved empathy mystery contagious yawning solved researcher closing answer hand given subject matter wouldn blame falling asleep wheel meantime yawn challenge try tougher look,body need oxygen yawn yawn oxygen air density oxygen air lower people body feel start yawn oxygen yawn contagious,,,,,,,,
best way heat cold hamburger,best way heat cold hamburger,eat heated hamburger suggest follow scrape ketchup mayo sauce hamburger vegetable second pre heat steak pan hamburger separate form bun hot panthird heat part bun near hamburger hot pan souce hamburger fourth original ketchup mayo vegetable better new one home bon appetite,eat heated hamburger suggest follow scrape ketchup mayo sauce hamburger vegetable second pre heat steak pan hamburger separate form bun hot panthird heat part bun near hamburger hot pan souce hamburger fourth original ketchup mayo vegetable better new one home bon appetite,probably microwave norway example outside main city remote frozen hamburger roadside joint heat request microwave heating bit soggy,,,,,,,,
vacation rental turk caicos,considering renting house turk caicos recommendation island best good place rent,like providenciales best beautiful beach scattered side providenciales spectacular mile stretch located grace bay protected healthy barrier reef provo hole golf course casino shopping centre marina growing number bar excellent restaurant provo diver water lover paradise,like providenciales best beautiful beach scattered side providenciales spectacular mile stretch located grace bay protected healthy barrier reef provo hole golf course casino shopping centre marina growing number bar excellent restaurant provo diver water lover paradise,,,,,,,,,
caffeine double latte large coffee,choosing double latte similar oz cup drip coffee caffeine,based this caffaq i large coffe mg caffeine double latte espresso shot mg,based this caffaq i large coffe mg caffeine double latte espresso shot mg,depends type coffee typically espresso us darker roasted blend actually caffeine example italian roast caffeine french roast depends strong coffee interesting info guide latte s inside coffee coffee and finally order complex bullshit like double tall half caff skim mochachino light foam ice cube likely spit drink,,,,,,,,
convertible seat,looking seat kid seatbelt,convertable cadilac el camino problem holding sized adult picture bit gas guzzler,convertable cadilac el camino problem holding sized adult picture bit gas guzzler,,,,,,,,,
optical mouse work glass table,surface,optical mouse use led camera rapidly capture image surface beneath mouse infomation camera analyzed dsp digital signal processor detect imperfection underlying surface determine motion material glass mirror shiny uniform surface interfere ability dsp accurately analyze surface beneath mouse glass transparent uniform mouse unable pick imperfection underlying surface determine motion mirrored surface problem constantly reflect image causing dsp recognize motion properly unable surface change associated movement mouse work properly,optical mouse use led camera rapidly capture image surface beneath mouse infomation camera analyzed dsp digital signal processor detect imperfection underlying surface determine motion material glass mirror shiny uniform surface interfere ability dsp accurately analyze surface beneath mouse glass transparent uniform mouse unable pick imperfection underlying surface determine motion mirrored surface problem constantly reflect image causing dsp recognize motion properly unable surface change associated movement mouse work properly,,,,,,,,,
invade iraq,invade iraq,small group politician believed strongly fact saddam hussien remained power gulf war signal weakness rest world invited attack terrorism shortly taking power george bush attack able use terrorist attack justify war iraq basis exaggerated threat development weapon mass destruction military strength brutality saddam regime led imagine military political victory relatively easy,small group politician believed strongly fact saddam hussien remained power gulf war signal weakness rest world invited attack terrorism shortly taking power george bush attack able use terrorist attack justify war iraq basis exaggerated threat development weapon mass destruction military strength brutality saddam regime led imagine military political victory relatively easy,lot oil iraq,tempting invaded iraq lot oil country deep economic problem capturing country xe oil actual need survival likely iraq invading kuwait scenario fall assumption think government come conclusion verge war religion likely ideology presumptuous try determent cause coming war think world wide spread medium form cable satellite internet pushed moslem regime extreme fearing secularity democratic influence penetrating country result raising best way maintain power gain hatred common man occupied hating outside enemy hatred kept county directed regime believe understands fanatic moslem regime started war democratic world time try fight invade iraq huge week moslem country thought easy defeat exactly reason afghanistan syria line,think yuval pretty spot proving ground focal point terror activity american soil liked saddam hussein country middle east rise join rabid speculation pentagon model say take year casualty rebuild dictatorship democracy list,,,,,,
best finish concrete surface,best finish concrete surface,depends looking tolerance cost simple plain finish similarly broom finish basically going wet concrete broom pattern cheap basic look cheap look high end finish imprinted concrete look like natual stone brick flexible tends expensive thing consider concrete surface tend crack show different level different finish impronted plain finish tends crack prominently finish like exposed aggregate small pebble concrete exposed showing tend crack visible attached example company provides different finish experience way overpriced want shop,depends looking tolerance cost simple plain finish similarly broom finish basically going wet concrete broom pattern cheap basic look cheap look high end finish imprinted concrete look like natual stone brick flexible tends expensive thing consider concrete surface tend crack show different level different finish impronted plain finish tends crack prominently finish like exposed aggregate small pebble concrete exposed showing tend crack visible attached example company provides different finish experience way overpriced want shop,,,,,,,,,
best road motorcycle trail,long distance trail ca,hear mojave road amazing search online,hear mojave road amazing search online,tzeelim army base podra handle,,,,,,,,
trans fat reduce,heard tras fat bad body daily food,trans fat occur manufactured food process partial hydrogenation hydrogen gas bubbled vegetable oil increase shelf life stabilize original polyunsatured oil resulting fat similar saturated fat raise bad ldl cholesterol lead clogged artery heart disease recently food label required list trans fat health risk remained hidden consumer early july fda regulation changed food label soon begin identifying trans fat content processed food,trans fat occur manufactured food process partial hydrogenation hydrogen gas bubbled vegetable oil increase shelf life stabilize original polyunsatured oil resulting fat similar saturated fat raise bad ldl cholesterol lead clogged artery heart disease recently food label required list trans fat health risk remained hidden consumer early july fda regulation changed food label soon begin identifying trans fat content processed food,,,,,,,,,
kid usually sleeping crib sleeping bed,kid usually sleeping crib sleeping bed,set time depends want bed kid big crib balance want kid getting bed night feel comfortable risk rolling bed sleep look reference hand account,set time depends want bed kid big crib balance want kid getting bed night feel comfortable risk rolling bed sleep look reference hand account,year old child big sleep crib,,,,,,,,
roth ira v,difference roth ira prefer,company benefit join money deposit account need pay tax time year roth ira tax restriction won able use roth income higher certain need pay tax capital gain taxble company suggest use work certain year use roth ira leverage tax,company benefit join money deposit account need pay tax time year roth ira tax restriction won able use roth income higher certain need pay tax capital gain taxble company suggest use work certain year use roth ira leverage tax,,,,,,,,,
cascading style sheet,pro con web developer cs,pro cs designed allow separation presentation structure font color background style element alignment border size moved stylesheet resulting considerably simpler  code  document smaller web browser usually cache site cs stylesheets lead reduction network traffic noticeably quicker page downloads naming confusing example author associate class desired presentational attribute example cs class applied emphasized text named bigred implying rendered large red font choice naming intuitive document author cause problem author later decides emphasized text instead green author left cs class called bigred describes green bug cs need work need work multiple browser platform harder debug simple ,pro cs designed allow separation presentation structure font color background style element alignment border size moved stylesheet resulting considerably simpler  code  document smaller web browser usually cache site cs stylesheets lead reduction network traffic noticeably quicker page downloads naming confusing example author associate class desired presentational attribute example cs class applied emphasized text named bigred implying rendered large red font choice naming intuitive document author cause problem author later decides emphasized text instead green author left cs class called bigred describes green bug cs need work need work multiple browser platform harder debug simple ,,,,,,,,,
plane fedex,heard largest airline world,according www fedex com web site air fleet aircraft including airbus boeing dc airbus boeing md atr boeing md atr boeing md boeing cessna boeing cessna b boeing dc fokker,according www fedex com web site air fleet aircraft including airbus boeing dc airbus boeing md atr boeing md atr boeing md boeing cessna boeing cessna b boeing dc fokker,,,,,,,,,
san francisco bay area sense rent buy,price rent price buying sense rent cover mortgage better rent house buy,renting v buying depends goal generally thinking buying better payment rent start building equity home govt incentivizes buy making property tax payment mortgage payment tax deductible having said current housing status bay area housing cost purchase relatively high rental price compared ownership cost relatively low relative rest country make lese sense buy v place line base decision think market going number tend main gain loss buying come appreciation depreciation,renting v buying depends goal generally thinking buying better payment rent start building equity home govt incentivizes buy making property tax payment mortgage payment tax deductible having said current housing status bay area housing cost purchase relatively high rental price compared ownership cost relatively low relative rest country make lese sense buy v place line base decision think market going number tend main gain loss buying come appreciation depreciation,important factor consider stage life decided settle want stay area year buying probably make sense want stay flexible term geographically want explore period working professionally mixed period time enjoy life mortgage reall mood killer,right moment recommend renting buying kiplinger recently predicted likelihood housing price falling year  personalfinance magazine archive realestate for stock market probably safer place park money,agreed point end day consider kind residence living standard like enjoy calculate month total cost home ownership property afford consider going reside residence long term consider historical real estate price california year period net decrease real estate pricing consider buying rent caveat renter looking buy,,,,,,
called heavy metal music,called heavy metal music,br mon iron butterfly started playing los angeles explained album cover iron symbolic heavy sound butterfly light appealing versatile object freely imagination iron butterfly debut album entitled heavy fact led zeppelin moniker came partly reference keith moon jest like lead balloon incorporated heavy metal sealed usage term late birmingham england centre industry given rock band evolved city led zeppelin black sabbath people suggest term heavy metal relation activity biography claimed sound came heavy guitar riff popular metal midland sandy pearlman original producer manager songwriter blue ayster cult claim person apply term heavy metal rock music widespread disputed hypothesis origin genre brought forth chas chandler manager jimi hendrix experience interview pb tv programme rock roll state heavy metal term originated new york time article reviewing jimi hendrix performance claim author described jimi hendrix experience like listening heavy metal falling sky precise source claim accuracy disputed documented usage term heavy metal referring style music appears issue creem review sir lord baltimore kingdom come review told sir lord baltimore pat best heavy metal trick book regardless origin heavy metal jibe initially quickly adopted adherent established band deep purple origin pop progressive rock immediately took heavy metal mantle adding distortion additional amplification,br mon iron butterfly started playing los angeles explained album cover iron symbolic heavy sound butterfly light appealing versatile object freely imagination iron butterfly debut album entitled heavy fact led zeppelin moniker came partly reference keith moon jest like lead balloon incorporated heavy metal sealed usage term late birmingham england centre industry given rock band evolved city led zeppelin black sabbath people suggest term heavy metal relation activity biography claimed sound came heavy guitar riff popular metal midland sandy pearlman original producer manager songwriter blue ayster cult claim person apply term heavy metal rock music widespread disputed hypothesis origin genre brought forth chas chandler manager jimi hendrix experience interview pb tv programme rock roll state heavy metal term originated new york time article reviewing jimi hendrix performance claim author described jimi hendrix experience like listening heavy metal falling sky precise source claim accuracy disputed documented usage term heavy metal referring style music appears issue creem review sir lord baltimore kingdom come review told sir lord baltimore pat best heavy metal trick book regardless origin heavy metal jibe initially quickly adopted adherent established band deep purple origin pop progressive rock immediately took heavy metal mantle adding distortion additional amplification,metal music termed way provide contrast life affirming buddy holiday rock roll summer love counter culture rock emphasis peace love contrast metal music emphasized morbidity glorified ancient civilization heroic struggle merging gothic attitude art rock broad scope progressive rock sound emphasized heavy literal reality cut word symbol grand theory remind mortal ultimately able control lifespan inherent ability clashed drastically pacifist hippie movement religious industrial sentiment broader society surrounding heavy drug culture term hey heavy man bringing downer conversation topic,,,,,,,,
best photo slideshow creation application,best photo slideshow creation application,recently tried product create end season slideshow childrens swim team mydvd sonic solution pictureshow ulead product mydvd easy use unacceptable flaw missing great feature creating long slideshows slide software automatically created chapter point problem audio drop chapter creating unpleasant silence seemingly random interval slide customer support recommendation solving problem forced look second product pictureshow ulead solved problem added feature think feature known ken burn effect subtly zoom pan photo frame playback allows slide sense motion viewed dvd created universally liked effect commented cool factor ui adding multiple audio track improved allow frame level control positioning audio dvd burning process large number mp photo took hour photo longer mydvd took similar task project template menu background provided product bit weak taste custom background main menu pictureshow great job slide great success audience people viewed end season impressed quality got numerous positive comment,recently tried product create end season slideshow childrens swim team mydvd sonic solution pictureshow ulead product mydvd easy use unacceptable flaw missing great feature creating long slideshows slide software automatically created chapter point problem audio drop chapter creating unpleasant silence seemingly random interval slide customer support recommendation solving problem forced look second product pictureshow ulead solved problem added feature think feature known ken burn effect subtly zoom pan photo frame playback allows slide sense motion viewed dvd created universally liked effect commented cool factor ui adding multiple audio track improved allow frame level control positioning audio dvd burning process large number mp photo took hour photo longer mydvd took similar task project template menu background provided product bit weak taste custom background main menu pictureshow great job slide great success audience people viewed end season impressed quality got numerous positive comment,,,,,,,,,
dvd bought,dvd bought,matrix reason got dvd player bad sequel suck,matrix reason got dvd player bad sequel suck,lord ring fellowship ring platinum series special extended edition reason finally gave vhs,bought matrix cause great movie,star war trilogy,bought time like dvd player godzilla jfk silence lamb day dvd near popular website offering bunch dollar,child dvd baby,dvd apocalypse,bought fistful dollar bought apocalypse redux,,
meaning life,meaning life,answer question need step ll notice fish frog ponder life meaning fact far tell animal live life best waste time pondering meaning given descended appropriate preface question ask meaning best answer anthropologist date time brain started recognize mortality concept behavior ancient society started change began bury dead began animistic proto religion sparked human ability recognize cause effect essential tool making set mental construct set possibility construct called meaning observed mean happened type simple causal reasoning allowed manner thing building stone tool developing science technology forming society rule reasoning applied question existence lot clear causal reasoning mean thing true useful easier understand meaning problem life meaning particular human kind got pretty creating artificial system meaning usually religion work existentialist came pulled rug right type thinking given life absolute meaning left option meaning subscribing old construct religion nietche suggested individual define meaning easier said probably way estable meaning subscribing illusion outside approach decided western origin eastern approach simply state important meaning life simply reach non meaning state flowing tao transcedental meditation allows escape sense self personal need meaning simply leave meaning doorstep helpful question meaning life actually absurd question considered answer absurd question simply absurd hope help,answer question need step ll notice fish frog ponder life meaning fact far tell animal live life best waste time pondering meaning given descended appropriate preface question ask meaning best answer anthropologist date time brain started recognize mortality concept behavior ancient society started change began bury dead began animistic proto religion sparked human ability recognize cause effect essential tool making set mental construct set possibility construct called meaning observed mean happened type simple causal reasoning allowed manner thing building stone tool developing science technology forming society rule reasoning applied question existence lot clear causal reasoning mean thing true useful easier understand meaning problem life meaning particular human kind got pretty creating artificial system meaning usually religion work existentialist came pulled rug right type thinking given life absolute meaning left option meaning subscribing old construct religion nietche suggested individual define meaning easier said probably way estable meaning subscribing illusion outside approach decided western origin eastern approach simply state important meaning life simply reach non meaning state flowing tao transcedental meditation allows escape sense self personal need meaning simply leave meaning doorstep helpful question meaning life actually absurd question considered answer absurd question simply absurd hope help,great monty python film missed,consider meaning life make meaning solely depends define make happy believe propose earth leave good happy life define happy agood life,plus minus,,,,,,
best powerful portable gps unit,rechargeable long lasting battery waterproof built map option topo street memory expandability large memory storage capability reception accuracy color display,cnet recently reviewed line magellan thought garmin streetpilot iii best vehicle navigation magellan roadmate raised bar note select best answer k page read question,cnet recently reviewed line magellan thought garmin streetpilot iii best vehicle navigation magellan roadmate raised bar note select best answer k page read question,,,,,,,,,
best way clean keyboard,small stuff stuck keyboard prevents working best way clean,commercial kit available compressed air lint free cloth wipe mild dishwashing liquid vacuum cleaner soft brush need basic cleaning turning unplugging keyboard gently shake keyboard upside newspaper dislodge loose crumb particle use compressed air blow stream air key dampen lint free cloth diluted solution dishwashing liquid water wipe key use vacuum cleaner brush attachment suck away remaining dirt debris membrane type keyboard spring key key truly grungy remove key small screwdriver use cotton swab isopropyl alcohol sparkling clean feeling industrious tackle cleaning mouse course cleaning keyboard truly undesirable task buy new,commercial kit available compressed air lint free cloth wipe mild dishwashing liquid vacuum cleaner soft brush need basic cleaning turning unplugging keyboard gently shake keyboard upside newspaper dislodge loose crumb particle use compressed air blow stream air key dampen lint free cloth diluted solution dishwashing liquid water wipe key use vacuum cleaner brush attachment suck away remaining dirt debris membrane type keyboard spring key key truly grungy remove key small screwdriver use cotton swab isopropyl alcohol sparkling clean feeling industrious tackle cleaning mouse course cleaning keyboard truly undesirable task buy new,,,,,,,,,
looking new bike,best bike road exercise thinking min ride time starter,finding right bike excercising fit riding bike fit cause pain likely knee problem starter indicates potentially want recommend finding good local shop measure bike correct size right angle area recommend  site intro cfm  expert finding adjusting bike cupertinobike bit hardcore rider dont forget buy good pair bike short saddle different soft necessarily comfy long run,finding right bike excercising fit riding bike fit cause pain likely knee problem starter indicates potentially want recommend finding good local shop measure bike correct size right angle area recommend  site intro cfm  expert finding adjusting bike cupertinobike bit hardcore rider dont forget buy good pair bike short saddle different soft necessarily comfy long run,recommend giant bike famous brand modern design choose bike depending need check following link,,,,,,,,
