subject,content,bestanswer,ans0,ans1,ans2,ans3,ans4,ans5,ans6,ans7,ans8,ans9
heck dalai lama,,dalai lama spiritual secular ruler buddhist tibet ruler lama leader follower belong sect tibetan buhhism tenzin gyatso tibetan xe xbd xe xbd xa xe xbe xe xbd xe xbc xe xbd xa xe xbd xe xbd xb xe xbd xe xbc xe xbd xa xe xbe xe xbe xb xe xbc xe xbd xe xbd xe xbd xbc xe xbc wylie bstan dzin rgya mtsho july fourteenth current dalai lama fifth child farming family tibetan province amdo proclaimed tulku reincarnation thirteenth dalai lama age november age enthroned tibet head state important political ruler tibet faced occupation force people republic china collapse tibetan resistance movement tenzin gyatso fled india active establishing government tibet exile preserving tibetan culture education thousand refugee accompanied charismatic figure noted public speaker tenzin gyatso dalai lama travel west helped spread buddhism publicise cause free tibet awarded nobel peace prize tibetan buddhism successive dalai lama taa la bla ma form tulku lineage gelugpa leader trace tibetan buddhist believe dalai lama present incarnation avalokitesvara chenrezig spyan ra gzigs tibetan bodhisattva compassion th century dalai lama head tibetan government controlling large portion country capital lhasa dalai lama authority region tibet sect tibetan buddhism current dalai lama th respected tibetan buddhist religious leader figurehead international tibet independence movement english granted style holiness hh title,dalai lama spiritual secular ruler buddhist tibet ruler lama leader follower belong sect tibetan buhhism tenzin gyatso tibetan xe xbd xe xbd xa xe xbe xe xbd xe xbc xe xbd xa xe xbd xe xbd xb xe xbd xe xbc xe xbd xa xe xbe xe xbe xb xe xbc xe xbd xe xbd xe xbd xbc xe xbc wylie bstan dzin rgya mtsho july fourteenth current dalai lama fifth child farming family tibetan province amdo proclaimed tulku reincarnation thirteenth dalai lama age november age enthroned tibet head state important political ruler tibet faced occupation force people republic china collapse tibetan resistance movement tenzin gyatso fled india active establishing government tibet exile preserving tibetan culture education thousand refugee accompanied charismatic figure noted public speaker tenzin gyatso dalai lama travel west helped spread buddhism publicise cause free tibet awarded nobel peace prize tibetan buddhism successive dalai lama taa la bla ma form tulku lineage gelugpa leader trace tibetan buddhist believe dalai lama present incarnation avalokitesvara chenrezig spyan ra gzigs tibetan bodhisattva compassion th century dalai lama head tibetan government controlling large portion country capital lhasa dalai lama authority region tibet sect tibetan buddhism current dalai lama th respected tibetan buddhist religious leader figurehead international tibet independence movement english granted style holiness hh title,,,,,,,,,
purpose web host,,wikipeadia web hosting service provides individual organization user online system storing information image video content accessible web web host company provide space server use client providing internet connectivity typically data center web host provide data center space connectivity internet server located data center,wikipeadia web hosting service provides individual organization user online system storing information image video content accessible web web host company provide space server use client providing internet connectivity typically data center web host provide data center space connectivity internet server located data center,purpose web site accessible internet web host care technical issue web page server,,,,,,,,
came chicken egg,,dinosaur laid egg million year ago chicken weren million year ago egg came later egg laying bird evolved chicken,dinosaur laid egg million year ago chicken weren million year ago egg came later egg laying bird evolved chicken, question qid,believe creation god created chicken looking somthing make sense read bible genesis sp chapter,actually easy answer based evolution egg come evolution work like slight change genetic information sex cell egg sperm individual passed offspring parent change genetic makeup called mutation mutation deleterious effect offspring genetic disorder arise time lethal mutation advantageous making individual fit neighbor referred conferring advantage mutation effect making change parent progeny case chicken evolved fit chicken eventually extinct chicken chicken organism mutation built time subsequent generation genetic makeup finally defined chicken individual conceived developed egg hatched egg sperm fused produce chicken bypass period gestation egg developed bird family million year chicken came simple answer question egg came believe fairy tale far nuspirit want claim egg chicken hatched wasn chicken egg let ask question defines label egg animal layed animal developing think argue way semantics organism chicken evolved likely similar chicken egg chicken layed similar egg chicken eventually lay able discern,think chicken egg come animal evolved small living cell egg come animal egg come need chicken lay hatch,chicken evolution happens mutation mutated chicken originated come animal egg refer mutated egg egg context chicken egg egg precursor animal mutated chicked successfully surived mated lay hatch egg,,,,
learning center offer personalized tutoring program portland,,answer great idea course work mind non person person tutoring contact local high school tutor tutor kid help high school student elective credit kid young kid look high school student newspaper advertising people looking work nanny care taker yes tutor try high school list tutorint center portland area  portland tutor asp l ,answer great idea course work mind non person person tutoring contact local high school tutor tutor kid help high school student elective credit kid young kid look high school student newspaper advertising people looking work nanny care taker yes tutor try high school list tutorint center portland area  portland tutor asp l ,try  high quality tutoring college student offer unlimited tutoring hour subject month tutoring internet tutoring tutor student try free hour tutoring try visit  toll free,clifford von millwright academy high learning,,,,,,,
ram,,window machine right click icon choose menu item property click general tab ram windowif macintosh running o click apple menu upper left hand corner choose mac window show ram,window machine right click icon choose menu item property click general tab ram windowif macintosh running o click apple menu upper left hand corner choose mac window show ram,asker hasn accepted earlier answer day assume running linux wasa trick question test bias diversityof qa user base case linux shell prompt type cat proc meminfo mouse required intuitive btw running linux install itfirst won worried whetheryou ram place,,,,,,,,
amg stand,,aufrecht melcher grossaspach answered question essentially mercedes sport designation similar car bmw car audi,aufrecht melcher grossaspach answered question essentially mercedes sport designation similar car bmw car audi,,,,,,,,,
sarbaines oxley compliant mean,firm advertising assist sarbaines oxley compliance explain legislation affected sarbaines oxley compliant,sarbanes oxley act sponsored senator paul sarbanes representative michael oxley response auditing scandal surrounding enron worldcom essentially aim protect investor requiring public company adhere certain standard auditor independence information integrity greater financial disclosure perspective ox compliance revolves preserving information ensuring system maintain financial record capturing correct data course ox compliance complex plenty consultant earn living making company ox compliant requirement public company,sarbanes oxley act sponsored senator paul sarbanes representative michael oxley response auditing scandal surrounding enron worldcom essentially aim protect investor requiring public company adhere certain standard auditor independence information integrity greater financial disclosure perspective ox compliance revolves preserving information ensuring system maintain financial record capturing correct data course ox compliance complex plenty consultant earn living making company ox compliant requirement public company,,,,,,,,,
old jesus today,,assume asking jesus man christian believe son christ jesus powerful god age answer second question old count year birth death estimated jesus born bce year old year calculate ce year add bce year year year hope help,assume asking jesus man christian believe son christ jesus powerful god age answer second question old count year birth death estimated jesus born bce year old year calculate ce year add bce year year year hope help,santa looked old jesus asking old jesus like asking high blue green smell like height smell color separate category time jesus separate category time god created jesus god god eternal begining end scripture say god existed eternity earth rest world formed psalm,,,,,,,,
fix flat product work damage,,essentially destroys inside tire order plug hole chemically bonding rubber tire use fix flat basically count buying new tire instead patching hole form debris remain tire fix flat trick thinking tire ok nail damage changing tire extremely simple practice ll surprised easy,essentially destroys inside tire order plug hole chemically bonding rubber tire use fix flat basically count buying new tire instead patching hole form debris remain tire fix flat trick thinking tire ok nail damage changing tire extremely simple practice ll surprised easy,,,,,,,,,
reality appearance actor ice faye cansenco,,reality surreal life,reality surreal life,,,,,,,,,
ex want casual relationship want,,absolutely honest ex isn willing commitment want setting heartache hand articulating feeling ex want term ll know feeling let,absolutely honest ex isn willing commitment want setting heartache hand articulating feeling ex want term ll know feeling let,friend worse relationship friendship feeling reciprocated,,,,,,,,
compress file,,run free program gzip download  specify machine certainly use gzip work important o,run free program gzip download  specify machine certainly use gzip work important o,use winzip,breed em smart,,,,,,,
public place bay area stay late till home work read,,college denny worked soda night refill coffee,college denny worked soda night refill coffee,happy donut palo alto late night stanford hangout,san francisco state reading area library believe close,,,,,,,
travel visa,country require visa travel united state visa,information  visa american americans_ for general travel question  travel,information  visa american americans_ for general travel question  travel,need visa enter brazil san francisco officeone embarcadero center suite san francisco ca voice local fax sfo traveldocs com link select country need visa information,,,,,,,,
expensive urethane golf ball titleist pro worth normal club golfer,handicap higher lower playing super hard fast green difference performance use exepnsive layer urethane golf ball instead cheaper one,pro best ball term providing durability distance control ve nike flight come pro real answer ball reacts swing game recommend playing round different brand,pro best ball term providing durability distance control ve nike flight come pro real answer ball reacts swing game recommend playing round different brand,think pro great ball extremely responsive sacrifice distance said play regular basis break tournament special occasion cost prohibitive reference handicap usually use srixon ball ad cost pack,,,,,,,,
recommendation clean quiet decent apartment complex vega,,depends want lived crystal creek warm spring henderson nv affordable place pretty decent,depends want lived crystal creek warm spring henderson nv affordable place pretty decent,,,,,,,,,
dollar exchanged real,,use credit card possible best rate plus safer carrying cash brazil need cash incidental taxi withdraw atm small service fee good rate,use credit card possible best rate plus safer carrying cash brazil need cash incidental taxi withdraw atm small service fee good rate,black market usually best option better rate able deal hotel worker,atm card best exchange rate exchange money cash chance ll ripped,,,,,,,
meaning life,stop searching,wich perspective look opinion physical reality incarnation purpouse spiritual growth body car soul driver aside believe devine word god source believe seek reunite source care love light,check  question qid,aproximately universe,wich perspective look opinion physical reality incarnation purpouse spiritual growth body car soul driver aside believe devine word god source believe seek reunite source care love light,,,,,,,
difference dating relationship,,difference level commitment dating connotes casual thing necessarily exclusive person say dating instead boyfriend probably guess relationship relatively new commitment ve decided relationship ll probably start referring boyfriend girlfriend ll introduce close friend family ll likely spend lot time granted ll certain night weekend depending lifestyle agree relationship exclusive stop seeing people uncomfortable discussing taking thing level probably dating ready relationship,difference level commitment dating connotes casual thing necessarily exclusive person say dating instead boyfriend probably guess relationship relatively new commitment ve decided relationship ll probably start referring boyfriend girlfriend ll introduce close friend family ll likely spend lot time granted ll certain night weekend depending lifestyle agree relationship exclusive stop seeing people uncomfortable discussing taking thing level probably dating ready relationship,,,,,,,,,
list important event year history,,link list important event,link list important event,,,,,,,,,
mark david chapman kill john lennon,,according ap article previously great fan beatles chapman began attaching caulfield favorite slander phony lennon assessment seeing photo lennon atop exclusive manhattan apartment building dakota point looking picture enraged broke chapman explain later remember saying mind killed felt identity killing john lennon,according ap article previously great fan beatles chapman began attaching caulfield favorite slander phony lennon assessment seeing photo lennon atop exclusive manhattan apartment building dakota point looking picture enraged broke chapman explain later remember saying mind killed felt identity killing john lennon,looser jeoulous popularity john lennon line looser,,,,,,,,
best buffet vega,,elegance wise probably wynn buffett best deal rio,elegance wise probably wynn buffett best deal rio,best buffet vega pharaoh pheast buffet luxor try bay buffet mandalay bay,,,,,,,,
house common refer hon gentleman answer gave earlier,,reason response scripted advance possible question house especially opposition designed game distract prepared text hope making look bad similar game played television correspondent interviewee give pat answer ask question time play emotive response referring questioner earlier prepared answer short circuit tactic stilted effective,reason response scripted advance possible question house especially opposition designed game distract prepared text hope making look bad similar game played television correspondent interviewee give pat answer ask question time play emotive response referring questioner earlier prepared answer short circuit tactic stilted effective,say honourable gentleman supposed refer mp according constituency represent honorifc bob mr smith suggest refer earlier answer want suggest answered question fact trying avoid difficult question answer mustn lie lying common automatic resignation offence,dislike repeating,,,,,,,
pair shoe imelda marcos left presidential palace,,imelda marcos large collection shoe lingerie reportedly owned pair shoe size xe opposition force marcos regime overthrown,imelda marcos large collection shoe lingerie reportedly owned pair shoe size xe opposition force marcos regime overthrown,,,,,,,,,
rid stretch mark pregnancy,,word strivectin reappropriated pretty people fantastic facial wrinkle cream know swears banish stretch mark forego preparation time,word strivectin reappropriated pretty people fantastic facial wrinkle cream know swears banish stretch mark forego preparation time,appears mothering magazine information wife belly butter,,,,,,,,
best high capacity mp player support music unlimited,looking great mp player gb space want work yahoo music unlimited mean support microsoft play sure rule ipod unfortunately,microsoft playsforsure website allows search subscription compatible player playsforsure logo confusing playsforsure device play subscription track like offered yahoo napster rhapsody select audio subscription option gb option list player  advancedsearch aspxonce ve identified player check  searchpage php category   tag ont hdmp filter help player right ve creative zen micro yme worked pretty definitely good ipod line fact support subscription music make valuable,microsoft playsforsure website allows search subscription compatible player playsforsure logo confusing playsforsure device play subscription track like offered yahoo napster rhapsody select audio subscription option gb option list player  advancedsearch aspxonce ve identified player check  searchpage php category   tag ont hdmp filter help player right ve creative zen micro yme worked pretty definitely good ipod line fact support subscription music make valuable,recommend creative zen sleek rival previous generation ipod size great user interface strong battery life great sound quality work great yme haven tested subscription service,creative zen micro gb work fine think,,,,,,,
city jack chrissy janet company live,,take place santa monica ca,take place santa monica ca,,,,,,,,,
sat important,,college university use sat score factor determining admission possible waiver case chance consideration greater sat reason sat financial aid consideration grant scholarship especially run school private organization sat score grade point average account,college university use sat score factor determining admission possible waiver case chance consideration greater sat reason sat financial aid consideration grant scholarship especially run school private organization sat score grade point average account,,,,,,,,,
reccomend cool brazilian restaurant san francisco bay area,love churrasco,espetus best frisco check website price www espetus com,espetus best frisco check website price www espetus com,canto brazil espetus churrascaria look like canto better,,,,,,,,
people love oprah,,personifies classic cinderella story american dream overcame poverty abuse huge tv success charismatic like stuff away,personifies classic cinderella story american dream overcame poverty abuse huge tv success charismatic like stuff away,sister law love oprah true humanitarian concerned welfare people share,think epitomizes power belief people change believe changing condition help non judgemental compassionate,,,,,,,
view internet wireless network,,yes,yes,experience wireless isn different direct connection streaming video run wireless network laptop battery run faster wireless,yes exactly othe internet,,,,,,,
english equivalent male firstname reinhard,visiting peets order speciality coffee asked firstname know english equivalent currently ryan reggie turned disaster according wikipedia reinhard composed ancient germanic word ragina advice harti hard strong meaning strong giving advice knowledgeable oh great yahoo yahoo reinhard,according page french wikipedia reinhard come regin hard strong advice mention e reinhard reinhard fox originally goupil french famous story reynard fox popularity fox character french fox renard instead goupil reinhard voir renard pour le sen le nom est port xc xa en alsace lorraine variantes reinhardt reinhart reinharth reinard reinardt reinartz reinert reinertz renard renart nom personne origine germanique raginhard ragin conseil hard dur faut il le rappeler le nom commun renard est au xc xa pr xc xa nom et est la popularit xc xa du goupil nomm xc xa renart dans le xc xa xc xa bre roman xc xa di xc xa val qui en fait peu xc xa peu nom commun english version information name  wiki reynardso ask people fox,according page french wikipedia reinhard come regin hard strong advice mention e reinhard reinhard fox originally goupil french famous story reynard fox popularity fox character french fox renard instead goupil reinhard voir renard pour le sen le nom est port xc xa en alsace lorraine variantes reinhardt reinhart reinharth reinard reinardt reinartz reinert reinertz renard renart nom personne origine germanique raginhard ragin conseil hard dur faut il le rappeler le nom commun renard est au xc xa pr xc xa nom et est la popularit xc xa du goupil nomm xc xa renart dans le xc xa xc xa bre roman xc xa di xc xa val qui en fait peu xc xa peu nom commun english version information name  wiki reynardso ask people fox,according babelfish translation pure hard sure good choice yahoo let yahoo yahoo yahoo com redirect,english friend tell reggie,reinhard german strong courageous counselorthe closest approximation french raynard reynard mythological character named reynard fox ray short,,,,,,
non vegetarian defensive mere mention vegetarian,,maybe feel special request tell party host vegetarian feel expect provide extra food suitable tell date vegetarian feel choice date restaurant limited lifestyle face vegetarianism activist feel judging choice eat meat ll win people way living aren demanding flexible choice invited dinner party offer bring vegetarian dish share invited dinner armed restaurant choice accomodate ethnic restaurant usually safe bet push belief definitely share asked vegetarianism personal choice know personal story compelling political statement,maybe feel special request tell party host vegetarian feel expect provide extra food suitable tell date vegetarian feel choice date restaurant limited lifestyle face vegetarianism activist feel judging choice eat meat ll win people way living aren demanding flexible choice invited dinner party offer bring vegetarian dish share invited dinner armed restaurant choice accomodate ethnic restaurant usually safe bet push belief definitely share asked vegetarianism personal choice know personal story compelling political statement,feel guilty non vegetarian thought killing innocent animal make guilty guess,,,,,,,,
popular programming laguage use today,,tough doubt potential debate point case doubt real future java hand written modern development platform foundation question choose language path school think java fine better programmer detailed understanding hood case bit assembly isn bad look higher level ultimately,tough doubt potential debate point case doubt real future java hand written modern development platform foundation question choose language path school think java fine better programmer detailed understanding hood case bit assembly isn bad look higher level ultimately,java gained momentum past year robust framework easy use api php popular future look java,,,,,,,,
odds life planet,,answer question vary greatly good framework think drake equation developed frank drake carl sagan run key factor effect viability life planet learn extrasolar planet astrobiology getting better limit parameter equation especially come term look intelligent life long contact specie little data come term need grain salt simply talking life think recent discovery likelihood high discovery extrasolar planet including closer earth size mean specific place point life formed forming stranger system feature planet time jupiter mass possible terrestrial satellite large planet harbor right condition life fun thing work drake equation term subjective data fun play stand best guess scientist forward right xc xc xc xc xc xc xc xc number intelligent civilization come communicate year number planet reach point harboring life intelligent year term xc xc xc new planet reach point life form year,answer question vary greatly good framework think drake equation developed frank drake carl sagan run key factor effect viability life planet learn extrasolar planet astrobiology getting better limit parameter equation especially come term look intelligent life long contact specie little data come term need grain salt simply talking life think recent discovery likelihood high discovery extrasolar planet including closer earth size mean specific place point life formed forming stranger system feature planet time jupiter mass possible terrestrial satellite large planet harbor right condition life fun thing work drake equation term subjective data fun play stand best guess scientist forward right xc xc xc xc xc xc xc xc number intelligent civilization come communicate year number planet reach point harboring life intelligent year term xc xc xc new planet reach point life form year,input drake equation odds life planet drake equation answer question relies knowing answer skeptical number odds know life earth started answer planet,great question opinion body vehicle driver soul spirit having said believe vehicle come shape size prove statistical number ask opinion race constantly created evolve adapting universe google search extraterestrial race detail planet depends witch look planet living entity opinion care love light,,,,,,,
know vacation rental service washington dc offer great rate,,know washington specific site good list vacation rental site comparative pricing review owner comment ,know washington specific site good list vacation rental site comparative pricing review owner comment ,try hotwire com,,,,,,,,
