subject,content,bestanswer,ans0,ans1,ans2,ans3,ans4,ans5,ans6,ans7,ans8,ans9
cheap hotel downtown la vega,,list cheap hotel la vega  hotel marketid service yhoe,list cheap hotel la vega  hotel marketid service yhoe,sahara room night dont know good definitely cheap,,,,,,,,
falafel,,falafel middle eastern specialty consisting small deep fried ball highly spiced ground vegetable usually chickpea fava bean mixed onion fresh herb generally tucked inside pita bread sandwich style served appetizer delicious hummus baba ghanoush yogurt tahini based sauce served falafel best,falafel middle eastern specialty consisting small deep fried ball highly spiced ground vegetable usually chickpea fava bean mixed onion fresh herb generally tucked inside pita bread sandwich style served appetizer delicious hummus baba ghanoush yogurt tahini based sauce served falafel best,falafel fried ball spiced field bean chickpea served yoghurt sauce sandwich pita bread appetizer,,,,,,,,
sound different hear voice,sound different listen voice answering machine tape recorder,specifically speak hear ear bone tissue head internally,specifically speak hear ear bone tissue head internally,speak voice transfer skull,,,,,,,,
recipe kimchi,,tablespoon plus teaspoon pickling salt cup water lb chinese napa cabbage cut inch square scallion cut inch length slivered tablespoon minced fresh ginger tablespoon korean ground dried hot pepper mildly hot ground red pepper teaspoon sugar dissolve tablespoon salt water cabbage large bowl crock nonreactive pot pour brine weight cabbage plate let cabbage stand hour drain cabbage reserving brine mix cabbage remaining ingredient including teaspoon salt pack mixture quart jar pour reserved brine cabbage cover push freezer bag mouth jar pour remaining brine bag seal bag let kimchi ferment cool place temperature higher xc xb day kimchi sour like remove brine bag cap jar tightly store kimchi refrigerator month recipe make quart fabulous food recipe,tablespoon plus teaspoon pickling salt cup water lb chinese napa cabbage cut inch square scallion cut inch length slivered tablespoon minced fresh ginger tablespoon korean ground dried hot pepper mildly hot ground red pepper teaspoon sugar dissolve tablespoon salt water cabbage large bowl crock nonreactive pot pour brine weight cabbage plate let cabbage stand hour drain cabbage reserving brine mix cabbage remaining ingredient including teaspoon salt pack mixture quart jar pour reserved brine cabbage cover push freezer bag mouth jar pour remaining brine bag seal bag let kimchi ferment cool place temperature higher xc xb day kimchi sour like remove brine bag cap jar tightly store kimchi refrigerator month recipe make quart fabulous food recipe,recipe recipelink comkimchi korean pickle lb korean cabbage water salt medium radish slice inch inch long carrot cut radish tbsp chopped green onion tbsp chopped garlic tbsp chopped ginger root fresh tbsp red pepper powderremove outside leaf cabbage cut head cutinto section lengthwise sectioned cabbage largepan sprinkle salt water cup salt cup water let stand hour cabbage softens mix radish carrot green onion garlic ginger red pepper set aside whencabbage softened drain water pat dry pack mixture vegetable cabbage leaf wrap cabbage outside leaf pour juice cabbageand vegetable mixture jar stuffedcabbage placed cover jar tightly let stand toripen day room temperature refriger ated,,,,,,,,
recommend easy healthy lunch idea,quick prepare night morning,recipe askmen comtuna bell pepper pocket ounce can drained solid white tuna water xc xbd cup chopped bell pepper xc xbc cup chopped celery xc xbc cup sliced onion lettuce leaf preferably green medium size sliced tomato slice total tbsp fat free italian dressing tbsp dried oregano tbsp black pepper inch pita breadscombine tuna green pepper celery onion bowl bowl combine dressing black pepper oregano pour tuna mix stir refrigerate hour serving tomato slice lettuce leaf pita bread add tuna mix pita serving,recipe askmen comtuna bell pepper pocket ounce can drained solid white tuna water xc xbd cup chopped bell pepper xc xbc cup chopped celery xc xbc cup sliced onion lettuce leaf preferably green medium size sliced tomato slice total tbsp fat free italian dressing tbsp dried oregano tbsp black pepper inch pita breadscombine tuna green pepper celery onion bowl bowl combine dressing black pepper oregano pour tuna mix stir refrigerate hour serving tomato slice lettuce leaf pita bread add tuna mix pita serving,try tuna chicken sandwich mayonnaise use multi grain bread usually lunch yogurt fruit,,,,,,,,
think win election west wing,,alan alda character arnold vinick going close election voting irregularity santos voter illegally turned away poll lawyer court involved supreme court ultimately handing election vinick loses popular vote farfetched tv,alan alda character arnold vinick going close election voting irregularity santos voter illegally turned away poll lawyer court involved supreme court ultimately handing election vinick loses popular vote farfetched tv,think santos win want continue series obvious ex republican working staff writer staff consultant given slant issue sustain series republican president maybe alan alda act like george fun,,,,,,,,
good location wedding east sf bay area july,ideal ceremony reception location church,partial location historic charm guest want consider piedmont community center sound digified lovely situated beautiful park ballroom open patio wedding ceremony patio reception indoors want consider brazilian room tilden park beautiful setting outdoor ceremony nice formal banquet hall think place popular location cal grad clarmont wonderful location outdoor ceremony nice banquet facilitiesbtw planning wedding year headstart ma holiday apparently alot couple engaged holiday mad competitive dash book venue jan febhappy planning,partial location historic charm guest want consider piedmont community center sound digified lovely situated beautiful park ballroom open patio wedding ceremony patio reception indoors want consider brazilian room tilden park beautiful setting outdoor ceremony nice formal banquet hall think place popular location cal grad clarmont wonderful location outdoor ceremony nice banquet facilitiesbtw planning wedding year headstart ma holiday apparently alot couple engaged holiday mad competitive dash book venue jan febhappy planning,downtown sf value try marine memorial club need sponsor military set great ballroom view sf,,,,,,,,
loving stepchild,marry child previous relationship believe love step child,child going accept substitute parent know child care support tough transition eventually love child think sign failure loving relationship come flavor friendly respectful relationship especially child older,child going accept substitute parent know child care support tough transition eventually love child think sign failure loving relationship come flavor friendly respectful relationship especially child older,,,,,,,,,
calorie soft drink,,manufacturer split calorie bottle size pretty expect calorie fluid ounce equates oz calorie oz bottle caloriesof course calorie vary greatly given style target market segment soft drink industry lot info favorite drink drink knew going bevnet industry source sort,manufacturer split calorie bottle size pretty expect calorie fluid ounce equates oz calorie oz bottle caloriesof course calorie vary greatly given style target market segment soft drink industry lot info favorite drink drink knew going bevnet industry source sort,calorie nutrition coca colafood quantity fl ozcalories calorie nutrition spritefood quantity fl ozcalories click link complete detail soft drink calorie content,,,,,,,,
type fresh cut christmas tree last longest,,fir tree expensive worth last longer,fir tree expensive worth last longer,know good care christmas tree buy type fresh cut christmas like check christmas tree care tip source,,,,,,,,
calorie wine,,varies alcohol sugar content strong sweet wine like port higher calorie load dry table wine normal strength assume ounce glass dry red white table wine likely calorie rich dessert wine calorie smaller ounce glass click link calorie chart,varies alcohol sugar content strong sweet wine like port higher calorie load dry table wine normal strength assume ounce glass dry red white table wine likely calorie rich dessert wine calorie smaller ounce glass click link calorie chart,,,,,,,,,
boil lobster,,large pot water cover lobster add generous handful salt come boil lobster pot head boil pound minute additional pound lobster pound minute additional pound,large pot water cover lobster add generous handful salt come boil lobster pot head boil pound minute additional pound lobster pound minute additional pound,ll need following large deep potlong tongslive lobstersboiling salted watermelted butterbring salted water rolling boil long tongs quickly carefully lower live lobster boiling water simmer minute lobster bright red serve melted butter dipping,,,,,,,,
base color,color create rest color mix,kind primary color combining light called additive mixing pigment called subtractive user know additive color red green blue traditionally subtractive color red yellow blue technically magenta yellow cyan kind blue,kind primary color combining light called additive mixing pigment called subtractive user know additive color red green blue traditionally subtractive color red yellow blue technically magenta yellow cyan kind blue,red blue yellow,,,,,,,,
true decorating home houseplant good feng shui,,decorating houseplant balance energy home great way positive flow chi great success area home,decorating houseplant balance energy home great way positive flow chi great success area home,yes plant balance energy create sense harmony room home feng shui indoor plant flower,,,,,,,,
poker legend doyle brunson nickname texas dolly,,doyle texas dolly brunson american professional poker player author poker book doyle brunson nickname texas dolly came incorrect reading jimmy greek snyder stuck,doyle texas dolly brunson american professional poker player author poker book doyle brunson nickname texas dolly came incorrect reading jimmy greek snyder stuck,,,,,,,,,
easy way open brand new jar jam pickle,usually bang jar knife loosens,jar new use triangular tipped bottle opener apply pressure break vacuum seal placing triangular tip underneath lid pulling lid away jar pop seal work suspect food stuck lid tap lid wooden spoon knock away food wrap lid dish towel hand traction twist rubber band lid good grip rubber band hold bunch vegetable ideal lid won budge run lid jar hot water minute cause metal lid expand come easily,jar new use triangular tipped bottle opener apply pressure break vacuum seal placing triangular tip underneath lid pulling lid away jar pop seal work suspect food stuck lid tap lid wooden spoon knock away food wrap lid dish towel hand traction twist rubber band lid good grip rubber band hold bunch vegetable ideal lid won budge run lid jar hot water minute cause metal lid expand come easily,use nutcracker adjusts size jar good twist pop lid,,,,,,,,
abc store honolulu,,abc store website say location island oahu weren specific honolulu got yahoo local brought search result abc store honolulu apparently smaller franchise inside hotel city look like location city honolulu follow link yahoo local closest best,abc store website say location island oahu weren specific honolulu got yahoo local brought search result abc store honolulu apparently smaller franchise inside hotel city look like location city honolulu follow link yahoo local closest best,,,,,,,,,
need wash rice cooking,,need rinse rice remove dirt like twig stone long grain white rice rinsed cooking remove excess starch removing starch make rice cook evenly make cooked rice sticky state rinse rice rinsing away vitamin mineral iron rice fortified vitamin mineral iron applied rice want wash rice cooking,need rinse rice remove dirt like twig stone long grain white rice rinsed cooking remove excess starch removing starch make rice cook evenly make cooked rice sticky state rinse rice rinsing away vitamin mineral iron rice fortified vitamin mineral iron applied rice want wash rice cooking,depends want rice cooked wash rice cooking prevent sticky rice wash rice time soak obtain separate perfectly cooked grain wash rice washing rice remove vitamin nutrient rice,,,,,,,,
rid rodent,,use glue trap small mouse spring trap rat spread peanut butter,use glue trap small mouse spring trap rat spread peanut butter,problem saw rat apartment want use mouse trap poison scattered floor came home work baitbits gone rat anymore week smell foul odor,,,,,,,,
best restaurant santa monica,,love jiraffe try dessert ,love jiraffe try dessert ,,,,,,,,,
good sushi,,ingredient sushi especially seafood fresh rice cake firm moist check source rice recipe sushi making tip,ingredient sushi especially seafood fresh rice cake firm moist check source rice recipe sushi making tip,,,,,,,,,
difference coke coke zero,,coke zero similar diet coke zero us aspartame acesulfame potassium sweetener diet us aspartame coke zero based formula regular coke diet coke based forumla coke half regular coke half coke zero,coke zero similar diet coke zero us aspartame acesulfame potassium sweetener diet us aspartame coke zero based formula regular coke diet coke based forumla coke half regular coke half coke zero,,,,,,,,,
stir fry,tip,preparing ingredient start stir fry quickly fry ingredient large pan high heat constantly stirring preserve flavor color texture vegetable crisp prepare meat chicken cut meat chicken bite size slice marinate protect overcooking marinade variety liquid depending flavor trying obtain typical marinade ingredient include chicken beef stock soy sauce hoisin sauce chili sauce corn starch brown sugar rice wine dry sherry marinate hour longer better prepare aromatic mixture consisting finely chopped herb spice add flavor aroma stir fry typical aromatics include garlic scallion red pepper flake shallot chili pepper prepare vegetable cutting small piece separating according cooking time slower cooking vegetable like asparagus green bean added faster cooking vegetable like pea pod tomato sample recipe stir fried chicken broccoli marinade ingredient cup chicken stock cup dry sherry rice wine tablespoon soy sauce tablespoon oyster sauce tablespoon cornstarch teaspoon sesame oil boneless chicken breast sliced strip aromatics clove garlic minced tablespoon ginger minced teaspoon crushed red pepper flake ingredient tablespoon oil bunch broccoli cut floret red pepper julienned large onion cut chunk cup halved cashew nut start prep recipe combining marinade ingredient cutting chicken breast strip letting marinate cut broccoli onion julienne red pepper preheat wok frying pan high heat add tablespoon oil add chicken reserving marinade stir fry minute chicken longer pink cook batch necessary remove set aside add remaining tablespoon oil stir fry aromatics second fragrant add vegetable stir fry minute add reserved marinade reserved chicken cook sauce thickens stirring frequently toss cashew serve white rice,preparing ingredient start stir fry quickly fry ingredient large pan high heat constantly stirring preserve flavor color texture vegetable crisp prepare meat chicken cut meat chicken bite size slice marinate protect overcooking marinade variety liquid depending flavor trying obtain typical marinade ingredient include chicken beef stock soy sauce hoisin sauce chili sauce corn starch brown sugar rice wine dry sherry marinate hour longer better prepare aromatic mixture consisting finely chopped herb spice add flavor aroma stir fry typical aromatics include garlic scallion red pepper flake shallot chili pepper prepare vegetable cutting small piece separating according cooking time slower cooking vegetable like asparagus green bean added faster cooking vegetable like pea pod tomato sample recipe stir fried chicken broccoli marinade ingredient cup chicken stock cup dry sherry rice wine tablespoon soy sauce tablespoon oyster sauce tablespoon cornstarch teaspoon sesame oil boneless chicken breast sliced strip aromatics clove garlic minced tablespoon ginger minced teaspoon crushed red pepper flake ingredient tablespoon oil bunch broccoli cut floret red pepper julienned large onion cut chunk cup halved cashew nut start prep recipe combining marinade ingredient cutting chicken breast strip letting marinate cut broccoli onion julienne red pepper preheat wok frying pan high heat add tablespoon oil add chicken reserving marinade stir fry minute chicken longer pink cook batch necessary remove set aside add remaining tablespoon oil stir fry aromatics second fragrant add vegetable stir fry minute add reserved marinade reserved chicken cook sauce thickens stirring frequently toss cashew serve white rice,thing remember stir frying sure ingredient prepared ahead time heat wok pan min add oil making sure circle side wok reaching wait wok smoking add meat wait second meat brown begin stir frying stirring constantly set stir fried meat aside add densest fibrous vegetable begin stir frying immediately continue adding vegetable order density return meat wok vegetable nearly cooked serve stir fried dish immediately,,,,,,,,
corner room,want furniture corner idea,indoor plant real artificial nice,indoor plant real artificial nice,consider small furniture like pedestal floral arrangement,,,,,,,,
married couple joint bank account credit card,,answer portion wife definitely convenient grocery shopping paying going dinner plus spawned fun game dinner get pretend generous come oh honey let care time,answer portion wife definitely convenient grocery shopping paying going dinner plus spawned fun game dinner get pretend generous come oh honey let care time,specific case like partner marriage citizen going process applying citizenship joint account required proof joint asset getting married wife went marriage counseling pastor handbook handled financial advice advocating joint account setting certain rule easier money management depending couple expense level everybody get certain allowance paycheck spend question asked second allowance based purchase item discussed spouse naturally emergency case like flat tire,suze orman pretty solid model handling joint individual account couple suggests partner maintain invidual account joint account joint account cover couple monthly expense food rent bill couple instead fair percentage based wage ex let mary make year husband john make year monthly expense come joint account mary john month perecentages dividing individual income couple total income mary john couple use percentage save thing like vacation,,,,,,,
earth superman different regular superman,superman older,relatively simple dc comic revealed golden age character lived different earth silver age character character batman robin wonder woman virtually earth flash green lantern atom radically different earth superman slightly powerful earth adhering classic faster speeding bullet powerful locomotive able leap tall building single bound description earth superman travel faster light juggle planet host super power including super breath super ventriloquism super hypnotism earth superman eventually married lois lane editor daily star temporarily disappearing crisis infinite earth earth superman finished adventure alan moore happened man tomorrow parter wrapped resolved year continuity superman supplanted john byrne reboot character intended simplify continuity start scratch earth superman reappeared twice crisis kingdom come recently infinite crisis role maxiseries undetermined writing earth superman reappear longtime fan hope,relatively simple dc comic revealed golden age character lived different earth silver age character character batman robin wonder woman virtually earth flash green lantern atom radically different earth superman slightly powerful earth adhering classic faster speeding bullet powerful locomotive able leap tall building single bound description earth superman travel faster light juggle planet host super power including super breath super ventriloquism super hypnotism earth superman eventually married lois lane editor daily star temporarily disappearing crisis infinite earth earth superman finished adventure alan moore happened man tomorrow parter wrapped resolved year continuity superman supplanted john byrne reboot character intended simplify continuity start scratch earth superman reappeared twice crisis kingdom come recently infinite crisis role maxiseries undetermined writing earth superman reappear longtime fan hope,,,,,,,,,
origin bubble cartoon denoting people speaking,reason difference solid baloons cloud like baloons,earliest date aware following usual associate comic book sic richard fenton outcalt creation yellow kid outcalt essentially synthesized introduced new element balloon space wrote character said pointed mouth kind tail source listed apparently italian language associate comic book bubble use word fumetti reference smoke,earliest date aware following usual associate comic book sic richard fenton outcalt creation yellow kid outcalt essentially synthesized introduced new element balloon space wrote character said pointed mouth kind tail source listed apparently italian language associate comic book bubble use word fumetti reference smoke,,,,,,,,,
cause insomnia high sugar intake,,person primary secondary insomnia primary insomnia having sleep problem directly associated health condition problem secondary insomnia having sleep problem health condition like depression heartburn cancer asthma arthritis pain medication taking substance like alcohol insomnia short term called acute insomnia long time called chronic insomnia short term insomnia acute insomnia night week caused emotional physical discomfort related single specific event chronic long term insomnia person insomnia night week month longer caused thing occurs health problem common cause chronic insomnia depression chronic stress pain discomfort night,person primary secondary insomnia primary insomnia having sleep problem directly associated health condition problem secondary insomnia having sleep problem health condition like depression heartburn cancer asthma arthritis pain medication taking substance like alcohol insomnia short term called acute insomnia long time called chronic insomnia short term insomnia acute insomnia night week caused emotional physical discomfort related single specific event chronic long term insomnia person insomnia night week month longer caused thing occurs health problem common cause chronic insomnia depression chronic stress pain discomfort night,stress anxiety cause insomnia,insomnia possible cause people trouble falling asleep people experience insomnia regular basis chronic insomnia attributed poor sleep habit symptom health problem advisable consult doctor insomnia issue useful online resource information insomnia yahoo health good starting place cause mentioned article include emotional stress depression use alcohol tobacco caffeine chronic pain physical condition breathing problem lack exercise sleep disorder sleep apnea high sugar intake particularly right bedtime stimulting effect make difficult fall asleep web search insomnia sugar yield page draw connection difficult locate authoritative source result general healthy balanced diet avoids excess sugar intake help prevent health problem lead reduction insomnia,,,,,,,
remove bleach spot carpet,roommate spilled barbecue sauce carpet purpose cleaner bleach carpet white spot rid bleach spot,spot old altered carpet color permanently suggest professional want insert carpet closet spot,spot old altered carpet color permanently suggest professional want insert carpet closet spot,blot white absorbent cloth paper towel blot rinse water gently blot detergent solution tsp mild dishwashing liquid cup fl oz ml warm water stain clean cloth paper towel work stain outside edge center let sit minute repeat blotting clean white cloth bleach transfer cloth bleach smell nearly gone stain old discolored carpet contact carpet professional,,,,,,,,
buy modern sofa bed easy sleep sit,,strongly recommend ektorp sofabed model swedish furniture store ikea easy sleep easy pull good sit price reasonable cushion washable last forever change color new cover closest store  m en_us,strongly recommend ektorp sofabed model swedish furniture store ikea easy sleep easy pull good sit price reasonable cushion washable last forever change color new cover closest store  m en_us,,,,,,,,,
worst hand pre flop texas hold em,play yes,worst hand dealt pre flop offsuit straight flush draw pair likely best hand blind hand referred big blind special time play hand given raise incredibly lucky hit trip kind pair house ok play half blind long raise blind small money compared stack good unpredictable,worst hand dealt pre flop offsuit straight flush draw pair likely best hand blind hand referred big blind special time play hand given raise incredibly lucky hit trip kind pair house ok play half blind long raise blind small money compared stack good unpredictable,,,,,,,,,
red red,decide red right universal criterion,probably red probably different red eye color interpreter electric pulse eye different different pulse different brain interpretation,probably red probably different red eye color interpreter electric pulse eye different different pulse different brain interpretation,great question believe definition red universal solution probably define way color defined world rgb hue sat lum understanding universal color,,,,,,,,
