subject,content,bestanswer,ans0,ans1,ans2,ans3,ans4,ans5,ans6,ans7,ans8,ans9
old girl start wearing makeup,,special occasion problem starting yr old start wearing day think important thing try convince youthful looking skin beautiful start covering young age,special occasion problem starting yr old start wearing day think important thing try convince youthful looking skin beautiful start covering young age,,,,,,,,,
hiccup,,hiccup sudden involuntary contraction diaphragm muscle muscle contract repeatedly opening vocal cord snap shut check inflow air make hiccup sound irritation nerve extend neck chest cause hiccup associated variety ailment pneumonia harmful substance build blood example kidney failure hiccup clear reason occurring,hiccup sudden involuntary contraction diaphragm muscle muscle contract repeatedly opening vocal cord snap shut check inflow air make hiccup sound irritation nerve extend neck chest cause hiccup associated variety ailment pneumonia harmful substance build blood example kidney failure hiccup clear reason occurring,,,,,,,,,
best pinot noir,,favorite ish siduri sonoma coast central coast bottlings typically pt wine acacia saintsbury chalone estate bottle castle rock russian river usually average,favorite ish siduri sonoma coast central coast bottlings typically pt wine acacia saintsbury chalone estate bottle castle rock russian river usually average,love saintsbury  about_pinotnoir ,fan firesteed,,,,,,,
best way incentivise people answer question,appeal ego wallet sense belonging,think effective way limit number question user answer day casual user answer th question day hard core user try answer question allowed work limit pretty small starting reasonably easy commitment achieve setting small limit requires user choose question want answer increase likelihood answer useful answer useful increase usefulness service turn incentivizes people answer question placing premium number question user answer unit time likelihood user throw throttle quickly bored decreased answer question allowed answer question day  question qid issue term incentivize shameless corporate speak describes impersonal profit oriented process attempt use softer language inherently cold calculating opportunistic necessarily bad wrong constitute euphemism misleading dangerous,think effective way limit number question user answer day casual user answer th question day hard core user try answer question allowed work limit pretty small starting reasonably easy commitment achieve setting small limit requires user choose question want answer increase likelihood answer useful answer useful increase usefulness service turn incentivizes people answer question placing premium number question user answer unit time likelihood user throw throttle quickly bored decreased answer question allowed answer question day  question qid issue term incentivize shameless corporate speak describes impersonal profit oriented process attempt use softer language inherently cold calculating opportunistic necessarily bad wrong constitute euphemism misleading dangerous,away dlp tv number answerer,think people enjoy demonstrating knowledge personally motivated away like tv think having kind recognition bit cooler interconnecting property people smart pretend,avoid marketing speak like incentivize human want incented want treated respect secretly want loved,,,,,,
recommendation good cpa charge reasonable fee indianapolis,,dunbar cook shepard accountant good far reasonable go bit street thorough save money worth isn,dunbar cook shepard accountant good far reasonable go bit street thorough save money worth isn,cpa,,,,,,,,
recommend good credit union located st louis,,joined meridian recently merged anheuser busch credit union happy financed car credit card personal loan easy business great rate,joined meridian recently merged anheuser busch credit union happy financed car credit card personal loan easy business great rate,main st,,,,,,,,
bowl game penn state going best way ticket,nittany lion,joe paterno retirement bowl held place florida,joe paterno retirement bowl held place florida,,,,,,,,,
tubular straw thing construction site,occasionally construction site lying ground look like mesh tube filled straw inch diameter foot long know called,called wattle placed ground prevent soil erosion construction site,called wattle placed ground prevent soil erosion construction site,assumed strategically placed prevent run polluted water course aren going completely seal area filter particle maybe pillow tired builder,,,,,,,,
state named king queen,,thing little sticky counting process virginia count officially virginia time think looking count state named king queen today right number think looking georgia latin english king george ii england louisiana french king louis xiv france maryland english queen henrietta maria england north carolina latin king charles ii england south carolina latin king charles ii england virginia latin english virgin country country virgin queen elizabeth england west virginia latin english western transmontane county virginia virginia course want squeeze new york named duke york later king england james ii ll leave best,thing little sticky counting process virginia count officially virginia time think looking count state named king queen today right number think looking georgia latin english king george ii england louisiana french king louis xiv france maryland english queen henrietta maria england north carolina latin king charles ii england south carolina latin king charles ii england virginia latin english virgin country country virgin queen elizabeth england west virginia latin english western transmontane county virginia virginia course want squeeze new york named duke york later king england james ii ll leave best,,,,,,,,,
cell phone pda allowed school,,think cell phone pda allowed student spend lot time playing showing cool feature gadget feature misused camera phone communicating emergency situation sure school phone,think cell phone pda allowed student spend lot time playing showing cool feature gadget feature misused camera phone communicating emergency situation sure school phone,,,,,,,,,
happened oregon trail game middle school,,middle school god old th edition oregon trail run winxp  ortr thed  ovraw oregon trail ovkey oregon trail ovmtc standard,middle school god old th edition oregon trail run winxp  ortr thed  ovraw oregon trail ovkey oregon trail ovmtc standard,,,,,,,,,
bring salary subject interview interviewer bring,,large company usually hr person coordinating interview hiring manager situation better bring question hr person round interview called interview think good time bring recruiter recruiter involved opinion bring compensation question till sense seriously considered exception mind trying decision choice interviewing multiple position candidly bring interview,large company usually hr person coordinating interview hiring manager situation better bring question hr person round interview called interview think good time bring recruiter recruiter involved opinion bring compensation question till sense seriously considered exception mind trying decision choice interviewing multiple position candidly bring interview,typically bring interview asked usually wait second interview clear indication company final candidate position going offer pose question hiring manager term entire compensation package salary ll usually benefit readily openly give opening ask salary range position,end interview interviewer asks question ask pay range position interviewing,,,,,,,
bmw premium gasoline,,bmw engine designed run high compression ratio took chemistry high school remember ideal gas rule pv nrt essentially state increased pressure increased temperature cylinder bmw run hot premium gas ignites higher temperature compatible engine car regular gas energy catch prematurely cylinder causing knocking pinging bad engine regular gas car smart catch power tiny damage potentially happen time car assume premium dial response pinging wouldn extended period time important know car designed run regular gas benefit premium bother,bmw engine designed run high compression ratio took chemistry high school remember ideal gas rule pv nrt essentially state increased pressure increased temperature cylinder bmw run hot premium gas ignites higher temperature compatible engine car regular gas energy catch prematurely cylinder causing knocking pinging bad engine regular gas car smart catch power tiny damage potentially happen time car assume premium dial response pinging wouldn extended period time important know car designed run regular gas benefit premium bother,,,,,,,,,
reco clean quiet decent apartment complex chicago area,,check apartment com chicago area load large building unit available great place look perfect clean quiet decent apartment complex area know chicago want live,check apartment com chicago area load large building unit available great place look perfect clean quiet decent apartment complex area know chicago want live,try looking local phone book yellow page section,,,,,,,,
best place celebrate new year santiago chile,,probably place donwtown plaza italia plaza armas popular place looking fancier wouldn know lot private party,probably place donwtown plaza italia plaza armas popular place looking fancier wouldn know lot private party,valparaiso vina del mar huge celebration close million people celebrate beach firework dancing lot pisco worth hour bus ride santiago,,,,,,,,
need wireless card laptop card compatible laptop best,,card compatible laptop mac powerbook ibook usb wireless network adapter regardless window mac laptop good idea double check wireless capability built nowadays assuming laptop run window built wireless adapter relatively recent model pentium ii newer cpu good hint wireless card work skip rest explanation laptop year old need sure support cardbus pcmcia card wireless pcmcia card use cardbus interface provides higher performance standard pcmcia interface unfortunately cardbus slot look like regular pcmcia slot tell laptop support looking easily tell wireless pcmcia card us cardbus gold strip end go pcmcia slot cardbus pcmcia card manufacturer wireless pcmcia card offer interface example siemens card picture clearly difference regular pcmcia card cardbus card  display articledirect index asp aid best depends wireless network support general good option reasonable price warning want buy wireless card use work check department buying provide wireless card shouldn buy second business configure wireless network use specific security feature want sure buy equipment compatible ok assuming want use wireless connectivity home wireless card support aka wireless suffice equipment wireless home network sold today us standard buy nowadays provide adequate security encryption option choice brand matter lot recommend single want brand rest wireless networking equipment instance linksys wireless router home linksys wireless card technically wireless equipment compatible won gory detail true equipment brand know tested manufacturer compatible software use setup piece equipment similar use description option thing confusing buying networking equipment wireless router recommend linksys ve disappointed product good performance reliability support good price boot product major retail store carry product like best buy hope help,card compatible laptop mac powerbook ibook usb wireless network adapter regardless window mac laptop good idea double check wireless capability built nowadays assuming laptop run window built wireless adapter relatively recent model pentium ii newer cpu good hint wireless card work skip rest explanation laptop year old need sure support cardbus pcmcia card wireless pcmcia card use cardbus interface provides higher performance standard pcmcia interface unfortunately cardbus slot look like regular pcmcia slot tell laptop support looking easily tell wireless pcmcia card us cardbus gold strip end go pcmcia slot cardbus pcmcia card manufacturer wireless pcmcia card offer interface example siemens card picture clearly difference regular pcmcia card cardbus card  display articledirect index asp aid best depends wireless network support general good option reasonable price warning want buy wireless card use work check department buying provide wireless card shouldn buy second business configure wireless network use specific security feature want sure buy equipment compatible ok assuming want use wireless connectivity home wireless card support aka wireless suffice equipment wireless home network sold today us standard buy nowadays provide adequate security encryption option choice brand matter lot recommend single want brand rest wireless networking equipment instance linksys wireless router home linksys wireless card technically wireless equipment compatible won gory detail true equipment brand know tested manufacturer compatible software use setup piece equipment similar use description option thing confusing buying networking equipment wireless router recommend linksys ve disappointed product good performance reliability support good price boot product major retail store carry product like best buy hope help,recommend lucent orinoco card work window linux mac o laptop good reliable driver inexpensive andrew,ve wise wifi engineer recommend atheros chipset cisco com linksys atheros better commitment standard compliance vendor notably intel centrino mean atheros card work reliably time competition option buy vendor equipment linksys netgear ll compatibility worry use hotspot bring laptop work wide compatibility money primary concern ve heard complaint cisco card link,,,,,,,
indie genre,,basic answer indie independent music music released smaller label operate independently mainstream music business indie refers specific genre contemporary music based combining aesthetic classic rock punk garage art rock heard term indie rock starting late early music popular college radio station time think definition changed type music fit umbrella diverse style popularity,basic answer indie independent music music released smaller label operate independently mainstream music business indie refers specific genre contemporary music based combining aesthetic classic rock punk garage art rock heard term indie rock starting late early music popular college radio station time think definition changed type music fit umbrella diverse style popularity,,,,,,,,,
flea market new york,,yes favorite amsterdam avenue th street sunday,yes favorite amsterdam avenue th street sunday,lot fame midst th street truly sight sore eye coney island,yes,,,,,,,
woman mean yes mean yes,try honest answer ask think fat true won hurt,understands woman woman xc xb understand woman think men xc xb think guess nature maybe charming agree anoying,understands woman woman xc xb understand woman think men xc xb think guess nature maybe charming agree anoying,stereotype people impose woman think presume woman like like mean yes yes,woman people want hear truth hurt feeling explicitly ask think majority people skinned come,husband honest thank want tight unflattering yes mean,problem private life double check person ask opinion ok true feeling person want feel assure fine want,,,,,
human finger toe,,according column read written jo xc xabl carbonnel nature able count researcher discovered limb digit distorted bow legged shape seriously interferes normal walking running  permit article regular joel htm,according column read written jo xc xabl carbonnel nature able count researcher discovered limb digit distorted bow legged shape seriously interferes normal walking running  permit article regular joel htm,virtually mammal finger toe finned animal like whale finger bone large connected body mammal including human descended family tree,,,,,,,,
serf best burger bay area,,friend taste test year concur expert newspaper barney restaurant oakland sf expanded burger joint mission sf wasn bad couse awesome fast food,friend taste test year concur expert newspaper barney restaurant oakland sf expanded burger joint mission sf wasn bad couse awesome fast food,serf niman ranch beef,question bay area blessed region world feature burger glamorous impressively overpriced preconception fast food chain aside simply fresher satisfying honestly prepared hamburger period burger view equal disdain cardboard like factory fake like macdonalds served local high school self proclaimed gourmet burger likely far fresh anyways,clark mountain view,jeffries san mateogarlic fry awesome,im going agree barney piedmont avenue oakland plus san francisco darla inner sunset good,think provides best burger value mcdonald french fry,hard wrong red robin cheesecake factory fuddruckers happy hound good way,,
difference betwen close knit family extended family,,close knit family simply family close apply nuclear family mom dad kid extended family cousin uncle grandparent extended family describes family unit extends mom dad kid include cousin uncle aunt grandparent,close knit family simply family close apply nuclear family mom dad kid extended family cousin uncle grandparent extended family describes family unit extends mom dad kid include cousin uncle aunt grandparent,,,,,,,,,
puppy stop biting finger toe body playing,shiba inu puppy week old loooves play reason like bite hard bite finger toe arm leg hair clothes pretty ve read lot idea online like bite stop playing ll run bite turn face way stop hurt toy play instead bite toy finger holding toy let know suggestion,recommend physical punishment hurt dog lose respect fear sensitive dog bit mouthed worked time put teeth skin scream retrack painful expression face dog visual respond better sign language verbal command run bite scream pretend stop dog bite fun think fun see distress bite ll learn stop,recommend physical punishment hurt dog lose respect fear sensitive dog bit mouthed worked time put teeth skin scream retrack painful expression face dog visual respond better sign language verbal command run bite scream pretend stop dog bite fun think fun see distress bite ll learn stop,way mother brother sister need respond small soft punch nose accommodate command time learn allowed strength bite,grab scruff neck hurt mother carry normally firmly establish pack leader soon nip rest day recommend good obedience course jean donaldson training book culture clash dog neptune,,,,,,,
league nation fail main actor failure,,failure league nation stop rise axis power start world war ii led eventual collapse economic sanction league called axis nation largely ignored nation stomach use military enforce league ruling axis nation withdrew league instead subjecting judgement united state member league despite woodrow wilson prime advocate,failure league nation stop rise axis power start world war ii led eventual collapse economic sanction league called axis nation largely ignored nation stomach use military enforce league ruling axis nation withdrew league instead subjecting judgement united state member league despite woodrow wilson prime advocate,,,,,,,,,
best recipe brining turkey,,hand alice water chez panisse fame recipe  food special secret brine ,hand alice water chez panisse fame recipe  food special secret brine ,like recipe good eats,,,,,,,,
shortest celebrity marriage,nikki hilton renee zellwegger super short marriage year got thinking celebrity shortest marriage time,overlook tiny technical zsa zsa gabor married husband mr gabor marriage husband shorter britney britney hour mr gabor day,overlook tiny technical zsa zsa gabor married husband mr gabor marriage husband shorter britney britney hour mr gabor day,britney spear,clearly answer tom thumb lavinia warren  mundie gallery little little htm,hour rudolph valentino jean ackerwed split november jury britney marriage shorter famed lover rudolph valentino hour bride locked valentino honeymoon suite soon gave headed home finalize divorce,,,,,,
difference shareholder stakeholder,,shareholder posse stakeholder non financial sense term stakeholder organization shareholder employee vendor customer community operates seen term context sustainable development matter wealth shareholder owning money goal include having positive environmental social impact usual wikipedia excellent definition,shareholder posse stakeholder non financial sense term stakeholder organization shareholder employee vendor customer community operates seen term context sustainable development matter wealth shareholder owning money goal include having positive environmental social impact usual wikipedia excellent definition,,,,,,,,,
good age married,,age important factor maturity people mature different age,age important factor maturity people mature different age,,,,,,,,,
web site traffic number page view particular web site,,alexa traffic ranking good way relative metric site control aware number reflect group people alexa toolbar installed computer yahoo listing  data detail traffic_details compare_sites url yahoo comif owner site webserver log run analyzer awtats e net,alexa traffic ranking good way relative metric site control aware number reflect group people alexa toolbar installed computer yahoo listing  data detail traffic_details compare_sites url yahoo comif owner site webserver log run analyzer awtats e net,,,,,,,,,
best karaoke club ktv south bay,looking ktv private room karaoke bar,fusia ok won let consume alcohol room compare ktv club asia high end,fusia ok won let consume alcohol room compare ktv club asia high end,san mateo called fusia ktv lounge private room el camino real th ave san mateo ca,,,,,,,,
differ,,minor model received significant refreshing cost effective major change,minor model received significant refreshing cost effective major change,,,,,,,,,
lexus anticipating releasing model run electric battery power gasoline,,yes lexus flagship going available hybrid l like toyota hybrid prius hybrid technology biased performance economy special status regard driving hov lane extremely fast efficient mid high,yes lexus flagship going available hybrid l like toyota hybrid prius hybrid technology biased performance economy special status regard driving hov lane extremely fast efficient mid high,,,,,,,,,
awesome fruit forward bodied wine nice peppery finish,big cab zin merlot drinker latest thing fruit forward red nice peppery bite finish recommendation,hi need start drinking syrah shiraz great fruit famous theirpeppery finish,hi need start drinking syrah shiraz great fruit famous theirpeppery finish,agree jrwallace check higher end syrahs walla walla valley washington oregon,definitely syrah particularly good ve recently syrah alexander valley vineyard qupe syrahs drinkable,probably looking shiraz particularly australia lot jammy berry flavour spice,,,,,,
mullet,,mullet mu lit family edible spiny rayed fish fresh salt water having small mouth feeble teeth striped gray mullet haircut side hair cut significantly shorter,mullet mu lit family edible spiny rayed fish fresh salt water having small mouth feeble teeth striped gray mullet haircut side hair cut significantly shorter,,,,,,,,,
coffee machine mc fixed alternatively anice espresso mc,,fast soon,fast soon,fixed today,,,,,,,,
best hd consumer camera,looking buy new hd video camera best sony hear good retail price manufacturer recommend specification look,wait hd video mainly number issue new technology hd camcorder halve price relatively short time hd video hooked hd display way editing outputing hd video hd capable set watching raw footage watch video hd consumer dvd device come cheaper solution recording editing outputing hd video happen fairly quickly year want fantastic quality spend canon gl offer better video quality hd consumer camcorder despite lower resolution wait,wait hd video mainly number issue new technology hd camcorder halve price relatively short time hd video hooked hd display way editing outputing hd video hd capable set watching raw footage watch video hd consumer dvd device come cheaper solution recording editing outputing hd video happen fairly quickly year want fantastic quality spend canon gl offer better video quality hd consumer camcorder despite lower resolution wait,,,,,,,,,
pair sneaker missy eliott,,said interview ve got sneaker classic jordan adidas louis vuitton chanel ridiculous try wear em time,said interview ve got sneaker classic jordan adidas louis vuitton chanel ridiculous try wear em time,imagine ll believe tell quoted interview espn addidas sneaker word possibly lined row closet forever best,,,,,,,,
carve pumpkin halloween,,pumpkin carving like halloween came celt carved pumpkin light inside supposed ward evil spirit celt having pumpkin use smaller tasty harder carve cousin turnip carved pumpkin turnip called jack lantern ancient irish legend jack smart lazy gambling selfish lad died accepted hell instead devil gave pumpkin turnip burning coal inside light way wandered round earth,pumpkin carving like halloween came celt carved pumpkin light inside supposed ward evil spirit celt having pumpkin use smaller tasty harder carve cousin turnip carved pumpkin turnip called jack lantern ancient irish legend jack smart lazy gambling selfish lad died accepted hell instead devil gave pumpkin turnip burning coal inside light way wandered round earth,,,,,,,,,
archie car,,lizzie archie jalopy car archie issue heart belongs lizzie,lizzie archie jalopy car archie issue heart belongs lizzie,lizzie,old betsy,lol read archie awhile know car cause like us veronica car lol oh wait yeah remember hahaha,,,,,,
